{
  "contract": "meldra.native-typed-hir.v1",
  "cst": {
    "adapter": "stage05p_frozen_performance_parser",
    "lossless": true,
    "normalized_sha256": "3512213b9d2ed7fbed1aa8faf3272c52d7906d361c4ea8d9198b97f834616074",
    "path": "compile-phases/bubble_sort_8.meldra",
    "source_sha256": "b9fde8411ff0d79be896a76c035f0ebf09c7fdb6d023cc7613323f92b50f5b6b"
  },
  "entry_function": "main",
  "invariants": {
    "effects_and_capabilities_explicit": true,
    "lossless_source": true,
    "source_mappings": true,
    "stable_symbol_ids": true
  },
  "nodes": [
    {
      "children": [
        "nhirn_6c76e1648069220c3c09b9c3d9df36f5c8fb2f7b6aa420c2c926fe982280103a"
      ],
      "id": "nhirn_8fd0488965ca9b00d4b74b4f74617206fa24c7dc81413d18eeb90c0f3444625a",
      "kind": "Module",
      "name": null,
      "operator": null,
      "source": null,
      "type": null,
      "value": null
    },
    {
      "children": [
        "nhirn_0d072fb29687a8cac3f6e3cffc685ac7c3ed9618ec3a3678755b82e2dbb1e5ae",
        "nhirn_98e6e1c6a7d3ea63898d0d26401ed1445295df79cddd485036e52efe7308a358",
        "nhirn_5569b01acc71318c86f07cf32f639739f73fd0cee6e76de0559fada6f7ccdd4c",
        "nhirn_c12c94c87b84c445386fbf5ab54d002f00fca2e0d152737a4790cbcb01100718",
        "nhirn_1c8f0fd1649538a15cff68f7341166ebe16ccd5ddcc49741a0833c2ec6c402c6"
      ],
      "id": "nhirn_6c76e1648069220c3c09b9c3d9df36f5c8fb2f7b6aa420c2c926fe982280103a",
      "kind": "FunctionDef",
      "name": "main",
      "operator": null,
      "source": {
        "column": 0,
        "end_column": 31,
        "end_line": 10,
        "line": 1,
        "path": "compile-phases/bubble_sort_8.meldra"
      },
      "type": "UInt64",
      "value": null
    },
    {
      "children": [
        "nhirn_8ce9820e7f397186c1cb8d866029e234e71214da1e31331c9750de8c3c44f005"
      ],
      "id": "nhirn_0d072fb29687a8cac3f6e3cffc685ac7c3ed9618ec3a3678755b82e2dbb1e5ae",
      "kind": "arguments",
      "name": null,
      "operator": null,
      "source": null,
      "type": null,
      "value": null
    },
    {
      "children": [
        "nhirn_713fa656546e002f022458e067ea670935cc1503e7d6fd6442490a53f1ee8483",
        "nhirn_c212130b91abf8087c7bb8478edca977e9beb25cf600fb2f17b52253740e30ec",
        "nhirn_f5f15bc7ca3d69a4558b3ae420c2804f882b851a93b413d2cc0979ca0f07864c"
      ],
      "id": "nhirn_98e6e1c6a7d3ea63898d0d26401ed1445295df79cddd485036e52efe7308a358",
      "kind": "AnnAssign",
      "name": null,
      "operator": null,
      "source": {
        "column": 4,
        "end_column": 55,
        "end_line": 2,
        "line": 2,
        "path": "compile-phases/bubble_sort_8.meldra"
      },
      "type": null,
      "value": null
    },
    {
      "children": [
        "nhirn_f01cc38ebf68bf56429951394c5d4328091c4f0b61065cb7c70d2166613ce02e",
        "nhirn_729b8a2bbe8a8c35d1b75ea3cce6c7b3a3324fc5b3e0489419ad759277468bb8",
        "nhirn_196411dc3b151d42f6730a06314134fe306cb39042477e412fde2b517e473090"
      ],
      "id": "nhirn_5569b01acc71318c86f07cf32f639739f73fd0cee6e76de0559fada6f7ccdd4c",
      "kind": "For",
      "name": null,
      "operator": null,
      "source": {
        "column": 4,
        "end_column": 49,
        "end_line": 9,
        "line": 3,
        "path": "compile-phases/bubble_sort_8.meldra"
      },
      "type": "UInt64",
      "value": null
    },
    {
      "children": [
        "nhirn_d337693deec8e9df78fe6cfc885d996281732132874e615ae23a45b97b1866c4"
      ],
      "id": "nhirn_c12c94c87b84c445386fbf5ab54d002f00fca2e0d152737a4790cbcb01100718",
      "kind": "Expr",
      "name": null,
      "operator": null,
      "source": {
        "column": 4,
        "end_column": 31,
        "end_line": 10,
        "line": 10,
        "path": "compile-phases/bubble_sort_8.meldra"
      },
      "type": "UInt64",
      "value": null
    },
    {
      "children": [
        "nhirn_f10da0fb7294c9e1c8be01fd0a73893b0789ab2ea626213db446e414f01f1c12"
      ],
      "id": "nhirn_1c8f0fd1649538a15cff68f7341166ebe16ccd5ddcc49741a0833c2ec6c402c6",
      "kind": "Name",
      "name": "UInt64",
      "operator": null,
      "source": {
        "column": 23,
        "end_column": 29,
        "end_line": 1,
        "line": 1,
        "path": "compile-phases/bubble_sort_8.meldra"
      },
      "type": null,
      "value": null
    },
    {
      "children": [
        "nhirn_82c37a6ccff0fbd85e29a40a2633f830a624956f0dd9be13a42b67efcd065c61"
      ],
      "id": "nhirn_8ce9820e7f397186c1cb8d866029e234e71214da1e31331c9750de8c3c44f005",
      "kind": "arg",
      "name": "n",
      "operator": null,
      "source": {
        "column": 9,
        "end_column": 18,
        "end_line": 1,
        "line": 1,
        "path": "compile-phases/bubble_sort_8.meldra"
      },
      "type": null,
      "value": null
    },
    {
      "children": [
        "nhirn_8790227186713d991e98e30fe6ea96a492921fa40b777766229951a876a78a93"
      ],
      "id": "nhirn_713fa656546e002f022458e067ea670935cc1503e7d6fd6442490a53f1ee8483",
      "kind": "Name",
      "name": "values",
      "operator": null,
      "source": {
        "column": 4,
        "end_column": 10,
        "end_line": 2,
        "line": 2,
        "path": "compile-phases/bubble_sort_8.meldra"
      },
      "type": null,
      "value": null
    },
    {
      "children": [
        "nhirn_197693a304330e1836e99ea2dcaa57bce2f7c1805c7f29be74214795cc009d16",
        "nhirn_6968f809d75a675b65ef5e760e06c19b30ab5fca66686581fdb13c9a981af00d",
        "nhirn_f10da0fb7294c9e1c8be01fd0a73893b0789ab2ea626213db446e414f01f1c12"
      ],
      "id": "nhirn_c212130b91abf8087c7bb8478edca977e9beb25cf600fb2f17b52253740e30ec",
      "kind": "Subscript",
      "name": null,
      "operator": null,
      "source": {
        "column": 12,
        "end_column": 28,
        "end_line": 2,
        "line": 2,
        "path": "compile-phases/bubble_sort_8.meldra"
      },
      "type": null,
      "value": null
    },
    {
      "children": [
        "nhirn_41bc462d46e2135cda15b1d2230507cb9c07c5f6b42ad8768827dbe25c8f9fc6",
        "nhirn_be99d14fce81578d44530cc454988063d5d6ce57c01fcfb7054736e41c5b9e4c",
        "nhirn_13e80e301b0d2f02d764513106018a8baa191f4a6be1da9125bb6f198662dd07",
        "nhirn_ed257c979d8a1930aa1c77dfcb82cfe4210bf55dd4058ca3b6553c25913d4f3d",
        "nhirn_7d063fd209f8cb468e6208e7c9b6e468a0d516436480e86f2272d896327d7d65",
        "nhirn_9274e1996a22cead3cc1dbd29c44954bb0a410bf456a95d7eb5b940d80d10d1e",
        "nhirn_4573d584179ce86daf7c0057911e50d47f4604c367e3a35316dbe0c8f46cd2ac",
        "nhirn_3dc9a660fdd933e0985631af793dffce8b3af9d78d55cd23560f1007638604b4",
        "nhirn_f10da0fb7294c9e1c8be01fd0a73893b0789ab2ea626213db446e414f01f1c12"
      ],
      "id": "nhirn_f5f15bc7ca3d69a4558b3ae420c2804f882b851a93b413d2cc0979ca0f07864c",
      "kind": "List",
      "name": null,
      "operator": null,
      "source": {
        "column": 31,
        "end_column": 55,
        "end_line": 2,
        "line": 2,
        "path": "compile-phases/bubble_sort_8.meldra"
      },
      "type": "Array[UInt64;8]",
      "value": null
    },
    {
      "children": [
        "nhirn_8790227186713d991e98e30fe6ea96a492921fa40b777766229951a876a78a93"
      ],
      "id": "nhirn_f01cc38ebf68bf56429951394c5d4328091c4f0b61065cb7c70d2166613ce02e",
      "kind": "Name",
      "name": "round",
      "operator": null,
      "source": {
        "column": 8,
        "end_column": 13,
        "end_line": 3,
        "line": 3,
        "path": "compile-phases/bubble_sort_8.meldra"
      },
      "type": null,
      "value": null
    },
    {
      "children": [
        "nhirn_c1c4a671dee5dae661426c3e4450ea8e7d671fabdb3a47fe0e39324744a125a9",
        "nhirn_3ecf1f4b598f09ffef735adfa599eedcfd8aa4f6ca294a07aa5de778f51a89f5",
        "nhirn_f3e63bc86bdbe6aeaa5deac235eebc2fb20f999e282faf58dc2d149410510a70"
      ],
      "id": "nhirn_729b8a2bbe8a8c35d1b75ea3cce6c7b3a3324fc5b3e0489419ad759277468bb8",
      "kind": "Call",
      "name": null,
      "operator": null,
      "source": {
        "column": 17,
        "end_column": 35,
        "end_line": 3,
        "line": 3,
        "path": "compile-phases/bubble_sort_8.meldra"
      },
      "type": null,
      "value": null
    },
    {
      "children": [
        "nhirn_3fed0d6d1008cead9c2bd3527891f5714487646c8cf3cdf3d3728d75088be978",
        "nhirn_0a4b5cd3fb1dcbf525c50dea642398c2223a6e852afa899c763e0b2b89880990",
        "nhirn_db311d02a0826adde01e3372a6fa9efb773628df097d8545e728306931d844ed"
      ],
      "id": "nhirn_196411dc3b151d42f6730a06314134fe306cb39042477e412fde2b517e473090",
      "kind": "For",
      "name": null,
      "operator": null,
      "source": {
        "column": 8,
        "end_column": 49,
        "end_line": 9,
        "line": 4,
        "path": "compile-phases/bubble_sort_8.meldra"
      },
      "type": "UInt64",
      "value": null
    },
    {
      "children": [
        "nhirn_701f6237d9cddb62599c3ccba0facf1b0562e4f9474e2cd0697d5d245e739211",
        "nhirn_594b913a916bd1312b341fae854d69efc6fea7e411e8d2458b0f212aec4e279d",
        "nhirn_639912ca163349260c77590d2d8ab5c62e853f7c66177847e1f446e2ab923a78"
      ],
      "id": "nhirn_d337693deec8e9df78fe6cfc885d996281732132874e615ae23a45b97b1866c4",
      "kind": "BinOp",
      "name": null,
      "operator": "Add",
      "source": {
        "column": 4,
        "end_column": 31,
        "end_line": 10,
        "line": 10,
        "path": "compile-phases/bubble_sort_8.meldra"
      },
      "type": "UInt64",
      "value": null
    },
    {
      "children": [],
      "id": "nhirn_f10da0fb7294c9e1c8be01fd0a73893b0789ab2ea626213db446e414f01f1c12",
      "kind": "Load",
      "name": null,
      "operator": null,
      "source": null,
      "type": null,
      "value": null
    },
    {
      "children": [
        "nhirn_f10da0fb7294c9e1c8be01fd0a73893b0789ab2ea626213db446e414f01f1c12"
      ],